{
  "schemaVersion": "0.1.0",
  "helperId": "kaifuu.fixture.helper-stub",
  "helperVersion": "0.1.0",
  "capabilities": [],
  "inputSchemaId": "kaifuu.helper.fixture-request.v0.1",
  "outputSchemaId": "kaifuu.helper-result.v0.1",
  "redactionClass": "public_fixture",
  "executionPolicy": {
    "policyId": "kaifuu-fixture-helper-stub-policy",
    "mode": "fixture_in_process",
    "allowlistRefId": "kaifuu-fixture-helper-stub-allowlist",
    "filesystemAccess": "none",
    "networkAccess": false,
    "maxRuntimeSeconds": 1
  }
}
